{
  "$schema": "https://json-schema.org/draft/2020-12/schema",
  "$id": "https://webuildconsortium.eu/schemas/ubo-attestation/0.4.0/ubo-attestation-schema.json",
  "title": "Ultimate Beneficial Owner (UBO) Attestation",
  "description": "SD-JWT VC schema for the WeBuild UBO Attestation (vct: eu.we-build:ubo:1). Provides a standardized, verifiable representation of the natural persons who ultimately own or control a legal entity, compliant with AMLR 2024/1624.",
  "type": "object",
  "required": [
    "vct",
    "iss",
    "iat",
    "exp",
    "attestation_legal_category",
    "ubo"
  ],
  "properties": {

    "vct": {
      "type": "string",
      "const": "eu.we-build:ubo:1",
      "description": "Verifiable Credential Type identifier. SHALL be the fixed string 'eu.we-build:ubo:1'."
    },

    "iss": {
      "type": "string",
      "description": "Issuer identifier (DID or URI) of the entity that issued this attestation.",
      "minLength": 1
    },

    "iat": {
      "type": "integer",
      "description": "Issued-at time as a Unix timestamp (seconds since epoch). SHALL be in the past.",
      "minimum": 0
    },

    "exp": {
      "type": "integer",
      "description": "Expiry time as a Unix timestamp (seconds since epoch). SHALL be greater than iat.",
      "minimum": 0
    },

    "jti": {
      "type": "string",
      "description": "Unique identifier for this credential instance (JWT ID).",
      "minLength": 1
    },

    "issuing_entity": {
      "type": "string",
      "description": "Identifier of the legal entity subject to the UBO disclosure obligation.",
      "minLength": 1
    },

    "attestation_legal_category": {
      "type": "string",
      "enum": ["EAA", "QEAA"],
      "description": "Legal category of this attestation per eIDAS 2. SHALL be 'EAA' (self-issued) or 'QEAA' (issued by a QTSP or authorised competent body). NOT selectively disclosable."
    },

    "schema_version": {
      "type": "string",
      "description": "Version of the schema used for this attestation.",
      "minLength": 1,
      "pattern": "^[0-9]+\\.[0-9]+\\.[0-9]+$"
    },

    "trust_anchor_url": {
      "type": "string",
      "format": "uri",
      "description": "URL where the trust anchor for verifying this attestation can be retrieved.",
      "minLength": 1
    },

    "ubo": {
      "type": "array",
      "description": "Array of Ultimate Beneficial Owner entries. SHALL contain at least one UBO entry.",
      "minItems": 1,
      "items": {
        "$ref": "#/$defs/UBOEntry"
      }
    },

    "status": {
      "type": "object",
      "description": "Revocation status claim. MUST be present if the validity period is greater than 24 hours.",
      "required": [
        "type",
        "status_list_credential",
        "status_list_index",
        "status_purpose"
      ],
      "properties": {

        "type": {
          "type": "string",
          "const": "status-list",
          "description": "SHALL be 'status-list'."
        },

        "status_list_credential": {
          "type": "string",
          "format": "uri",
          "description": "URI of the Status List Credential document containing the status bitstring.",
          "minLength": 1
        },

        "status_list_index": {
          "type": "integer",
          "description": "Zero-based index into the status list bitstring corresponding to this credential.",
          "minimum": 0
        },

        "status_purpose": {
          "type": "string",
          "const": "revocation",
          "description": "SHALL be 'revocation'."
        }

      },
      "additionalProperties": false
    },

    "cnf": {
      "type": "object",
      "description": "Confirmation claim binding the credential to the holder's key material per RFC 7800.",
      "properties": {
        "jwk": {
          "type": "object",
          "description": "JSON Web Key of the holder.",
          "required": ["kty"],
          "properties": {
            "kty": { "type": "string" },
            "crv": { "type": "string" },
            "x":   { "type": "string" },
            "y":   { "type": "string" },
            "n":   { "type": "string" },
            "e":   { "type": "string" }
          },
          "additionalProperties": false
        }
      },
      "additionalProperties": false
    }

  },

  "additionalProperties": false,

  "$defs": {

    "UBOEntry": {
      "type": "object",
      "title": "UBOEntry",
      "description": "A single Ultimate Beneficial Owner entry containing personal identity, address, identifier, justification, and source attributes.",
      "required": [
        "jurisdiction",
        "person",
        "birth_place",
        "citizenship",
        "residential_address",
        "person_identifier",
        "justification",
        "effective_date",
        "source"
      ],
      "properties": {

        "jurisdiction": {
          "type": "string",
          "description": "Jurisdiction of the subject legal entity. SHALL be a valid ISO 3166-1 alpha-2 country code.",
          "pattern": "^[A-Z]{2}$",
          "minLength": 2,
          "maxLength": 2
        },

        "person": {
          "$ref": "#/$defs/Person"
        },

        "birth_place": {
          "$ref": "#/$defs/BirthPlace"
        },

        "citizenship": {
          "type": "array",
          "description": "Citizenship(s) held by the natural person. SHALL contain at least one valid ISO 3166-1 alpha-2 country code. MAY contain multiple entries for persons holding multiple nationalities.",
          "minItems": 1,
          "items": {
            "type": "string",
            "pattern": "^[A-Z]{2}$",
            "minLength": 2,
            "maxLength": 2,
            "description": "ISO 3166-1 alpha-2 country code."
          },
          "uniqueItems": true
        },

        "residential_address": {
          "$ref": "#/$defs/ResidentialAddress"
        },

        "contact_address": {
          "$ref": "#/$defs/ContactAddress",
          "description": "Optional alternative contact address for the natural person."
        },

        "person_identifier": {
          "$ref": "#/$defs/PersonIdentifier"
        },

        "person_unique_identifier": {
          "$ref": "#/$defs/PersonUniqueIdentifier",
          "description": "Optional unique identifier assigned by an authority to uniquely identify the natural person."
        },

        "justification": {
          "$ref": "#/$defs/Justification"
        },

        "effective_date": {
          "type": "string",
          "description": "Date from which UBO status has been effective. SHALL be a valid ISO 8601 date (YYYY-MM-DD) in the past.",
          "format": "date",
          "pattern": "^[0-9]{4}-[0-9]{2}-[0-9]{2}$"
        },

        "source": {
          "type": "array",
          "description": "Supporting evidence substantiating the UBO determination. SHALL contain at least one entry.",
          "minItems": 1,
          "items": {
            "$ref": "#/$defs/Source"
          }
        }

      },
      "additionalProperties": false
    },

    "Person": {
      "type": "object",
      "title": "Person",
      "description": "Personal identity attributes of the natural person identified as UBO.",
      "required": [
        "first_name",
        "surname"
      ],
      "properties": {

        "first_name": {
          "type": "string",
          "description": "First name(s) of the natural person, including middle names where applicable. SHALL be non-empty.",
          "minLength": 1
        },

        "surname": {
          "type": "string",
          "description": "Surname(s) / family name(s) of the natural person. SHALL be non-empty.",
          "minLength": 1
        },

        "birth_date": {
          "type": "string",
          "description": "Date of birth of the natural person. SHALL be a valid ISO 8601 date (YYYY-MM-DD) in the past. Optional — may be omitted in specific jurisdictions.",
          "format": "date",
          "pattern": "^[0-9]{4}-[0-9]{2}-[0-9]{2}$"
        }

      },
      "additionalProperties": false
    },

    "BirthPlace": {
      "type": "object",
      "title": "BirthPlace",
      "description": "Place of birth of the natural person.",
      "required": [
        "locality",
        "country"
      ],
      "properties": {

        "locality": {
          "type": "string",
          "description": "City or locality of birth. SHALL be non-empty.",
          "minLength": 1
        },

        "country": {
          "type": "string",
          "description": "Country of birth. SHALL be a valid ISO 3166-1 alpha-2 country code.",
          "pattern": "^[A-Z]{2}$",
          "minLength": 2,
          "maxLength": 2
        },

        "region": {
          "type": "string",
          "description": "Region or state of birth. Optional.",
          "minLength": 1
        }

      },
      "additionalProperties": false
    },

    "ResidentialAddress": {
      "type": "object",
      "title": "ResidentialAddress",
      "description": "Registered residential address of the natural person.",
      "required": [
        "street",
        "house_number",
        "locality",
        "region",
        "postal_code",
        "country"
      ],
      "properties": {

        "street": {
          "type": "string",
          "description": "Street name of the residential address. SHALL be non-empty.",
          "minLength": 1
        },

        "house_number": {
          "type": "string",
          "description": "House or building number of the residential address. SHALL be non-empty.",
          "minLength": 1
        },

        "locality": {
          "type": "string",
          "description": "City or locality of the residential address. SHALL be non-empty.",
          "minLength": 1
        },

        "region": {
          "type": "string",
          "description": "Region or state of the residential address. SHALL be non-empty.",
          "minLength": 1
        },

        "postal_code": {
          "type": "string",
          "description": "Postal code of the residential address. SHALL be non-empty.",
          "minLength": 1
        },

        "country": {
          "type": "string",
          "description": "Country of the residential address. SHALL be a valid ISO 3166-1 alpha-2 country code.",
          "pattern": "^[A-Z]{2}$",
          "minLength": 2,
          "maxLength": 2
        }

      },
      "additionalProperties": false
    },

    "ContactAddress": {
      "type": "object",
      "title": "ContactAddress",
      "description": "Optional alternative contact address for the natural person. If present, all fields are required.",
      "required": [
        "street",
        "house_number",
        "locality",
        "region",
        "postal_code",
        "country"
      ],
      "properties": {

        "street": {
          "type": "string",
          "description": "Street name of the contact address.",
          "minLength": 1
        },

        "house_number": {
          "type": "string",
          "description": "House or building number of the contact address.",
          "minLength": 1
        },

        "locality": {
          "type": "string",
          "description": "City or locality of the contact address.",
          "minLength": 1
        },

        "region": {
          "type": "string",
          "description": "Region or state of the contact address.",
          "minLength": 1
        },

        "postal_code": {
          "type": "string",
          "description": "Postal code of the contact address.",
          "minLength": 1
        },

        "country": {
          "type": "string",
          "description": "Country of the contact address. SHALL be a valid ISO 3166-1 alpha-2 country code.",
          "pattern": "^[A-Z]{2}$",
          "minLength": 2,
          "maxLength": 2
        }

      },
      "additionalProperties": false
    },

    "PersonIdentifier": {
      "type": "object",
      "title": "PersonIdentifier",
      "description": "Government-issued identity document used to identify the natural person.",
      "required": [
        "document_type",
        "document_number",
        "issuing_country",
        "expiry_date"
      ],
      "properties": {

        "document_type": {
          "type": "string",
          "description": "Type of identity document. SHALL use one of the enumerated values from Section 2.8.1.",
          "enum": [
            "PASSPORT",
            "NATIONAL_ID",
            "RESIDENCE_PERMIT",
            "DRIVING_LICENSE",
            "OTHER"
          ]
        },

        "document_number": {
          "type": "string",
          "description": "Number of the identity document as printed on the document. SHALL be non-empty.",
          "minLength": 1
        },

        "issuing_country": {
          "type": "string",
          "description": "Country that issued the identity document. SHALL be a valid ISO 3166-1 alpha-2 country code.",
          "pattern": "^[A-Z]{2}$",
          "minLength": 2,
          "maxLength": 2
        },

        "expiry_date": {
          "type": "string",
          "description": "Expiry date of the identity document. SHALL be a valid ISO 8601 date (YYYY-MM-DD).",
          "format": "date",
          "pattern": "^[0-9]{4}-[0-9]{2}-[0-9]{2}$"
        }

      },
      "additionalProperties": false
    },

    "PersonUniqueIdentifier": {
      "type": "object",
      "title": "PersonUniqueIdentifier",
      "description": "Optional unique identifier assigned by an authority to uniquely identify the natural person across systems.",
      "properties": {

        "identifier_unique": {
          "type": "string",
          "description": "A unique identifier assigned to the natural person by an issuing authority.",
          "minLength": 1
        },

        "identifier_issuing_authority": {
          "type": "string",
          "description": "The authority that issued the unique identifier.",
          "minLength": 1
        }

      },
      "additionalProperties": false
    },

    "Justification": {
      "type": "object",
      "title": "Justification",
      "description": "How and why this natural person qualifies as a UBO under AMLR 2024/1624.",
      "required": [
        "threshold_met"
      ],
      "properties": {

        "threshold_met": {
          "type": "array",
          "description": "Array of applicable AML thresholds or control criteria met by this UBO. SHALL use values from Section 2.8.2. SHALL contain at least one value.",
          "minItems": 1,
          "items": {
            "type": "string",
            "enum": [
              "ownership_25_plus",
              "ownership_direct",
              "ownership_indirect",
              "control_voting_25_plus",
              "control_voting_direct",
              "control_voting_indirect",
              "control_management",
              "control_veto",
              "control_contractual",
              "control_family_relationships",
              "control_acting_in_concert",
              "control_nominee",
              "control_other_means",
              "arrangement_settlor",
              "arrangement_trustee",
              "arrangement_beneficiary",
              "arrangement_protector",
              "arrangement_object_of_power",
              "arrangement_default_taker",
              "arrangement_other_control"
            ],
            "description": "A single AML threshold or control criterion code from Section 2.8.2."
          },
          "uniqueItems": true
        },

        "ownership_percentage": {
          "type": "number",
          "description": "Total direct and indirect ownership percentage held by the UBO (0–100). SHOULD be provided if threshold_met includes 'ownership_25_plus'.",
          "minimum": 0,
          "maximum": 100
        },

        "voting_rights_percentage": {
          "type": "number",
          "description": "Total direct and indirect voting rights percentage held by the UBO (0–100). SHOULD be provided if threshold_met includes 'control_voting_25_plus'.",
          "minimum": 0,
          "maximum": 100
        },

        "control_details": {
          "type": "string",
          "description": "Free text description of control exercised through means other than ownership percentage. SHALL be provided if threshold_met includes 'control_other_means'.",
          "minLength": 1
        }

      },
      "additionalProperties": false,
      "if": {
        "properties": {
          "threshold_met": {
            "contains": {
              "const": "control_other_means"
            }
          }
        }
      },
      "then": {
        "required": ["control_details"]
      }
    },

    "Source": {
      "type": "object",
      "title": "Source",
      "description": "Supporting evidence substantiating the UBO determination. At least one source SHALL be present per UBO entry.",
      "required": [
        "id",
        "type"
      ],
      "properties": {

        "id": {
          "type": "string",
          "description": "Unique identifier for the source document. SHALL be non-empty.",
          "minLength": 1
        },

        "type": {
          "type": "string",
          "description": "Type of source document. SHOULD use values from Section 2.8.5.",
          "enum": [
            "ShareRegister",
            "CommercialRegister",
            "TransparencyRegister",
            "TrustDeed",
            "ShareholderAgreement",
            "ArticlesOfAssociation",
            "GovernanceChart",
            "AMLOfficerDeclaration",
            "NotarialDeed",
            "Other"
          ]
        },

        "url": {
          "type": "string",
          "format": "uri",
          "description": "URI reference to the source or evidence document. Optional.",
          "minLength": 1
        },

        "data": {
          "type": "string",
          "description": "Base64-encoded source document. SHALL be provided if url is not a publicly accessible URI.",
          "contentEncoding": "base64",
          "minLength": 1
        }

      },
      "additionalProperties": false
    }

  }
}